{
  "CursorSize": "Large",
  "FaceName": "Delugia Nerd Font",
  "FontFamily": true,
  "FontSize": "0x20",
  "FontWeight": false,
  "FullScreen": false,
  "HistoryBufferSize": 999,
  "HistoryNoDup": false,
  "InsertMode": true,
  "LoadConIme": true,
  "NumberOfHistoryBuffers": 8,
  "PopupColors" : "White,DarkCyan",
  "PROMPT" : "$E[0;30;41m %ComputerName% $E[31;42m $P $E[0;32m$E[1;30m ",
  "QuickEdit": true,
  "ScreenBufferSize": "80x1000",
  "ScreenColors": "Gray,Black",
  "WindowAlpha": 229,
  "WindowSize": "80x25"
}